Contractor;JAN;FEB;MAR;APR;MAY;JUN;JUL;AUG;SEP;OCT;NOV;DEC
BOB PT. BUMI SIAK PUSAKO - PERTAMINA HULU;8,514;8,911;8,621;8,633;8,686;8,483;8,436;8,448;8,224;8,180;8,625;8,520
BP BERAU LTD;5,831;5,703;5,322;5,287;4,262;6,090;5,915;5,873;4,812;5,339;5,855;5,748
CAMAR RESOURCES CANADA INC.;9;0;36;311;206;177;0;0;0;0;0;0
CHEVRON MAKASSAR LTD;1,057;1,235;1,229;1,229;1,054;931;886;848;953;861;1,111;1,166
CHEVRON RAPAK LTD.;726;710;708;677;677;660;655;605;578;545;583;562
CITIC SERAM ENERGY LTD;1,517;1,521;1,522;1,543;1,508;1,534;1,484;1,535;1,408;1,344;1,490;1,441
PT PERTAMINA HULU ENERGI OSES;24,003;23,580;24,463;26,057;25,365;24,020;22,708;23,894;23,031;25,014;24,978;24,888
CONOCOPHILLIPS (GRISSIK) LTD.;5,990;5,428;10,330;6,763;3,805;5,642;9,253;8,164;7,322;5,985;6,693;7,588
ENERGI MEGA PERSADA MALACCA STRAIT S.A.;4,533;4,744;4,650;4,470;4,531;4,945;4,687;4,456;4,796;4,882;5,144;5,189
ENERGY EQUITY EPIC (SENGKANG) PTY. LTD.;1;1;1;0;2;0;0;1;1;1;1;1
ENI MUARA BAKAU B.V.;690;1,474;1,533;1,174;1,185;1,206;1,130;1,143;1,127;1,117;1,065;947
HUSKY-CNOOC MADURA LTD.;6,758;6,671;5,940;5,283;6,275;7,122;7,075;6,949;6,838;6,511;6,787;6,909
PT PERTAMINA HULU ENERGI RAJA TEMPIRAI;368;332;317;297;194;192;298;329;327;253;270;285
JOB PERTAMINA - MEDCO TOMORI SULAWESI LTD;7,870;7,718;7,373;7,619;6,602;7,606;7,675;7,772;879;7,319;6,377;7,986
PETROGAS (ISLAND) LTD.;788;771;705;725;720;733;878;833;867;822;810;832
KALREZ PETROLEUM (SERAM) LTD;222;218;210;203;201;211;201;201;189;211;214;213
KANGEAN ENERGI INDONESIA;63;69;78;72;69;61;63;67;65;62;46;57
MINARAK BRANTAS GAS INC.;0;0;0;0;0;0;0;0;0;0;0;0
MANDALA ENERGY LEMANG PTE. LTD.;0;0;0;0;0;0;0;0;0;0;0;0
MEDCO E & P NATUNA;16,479;16,176;15,865;15,158;13,433;12,855;12,471;14,055;12,941;12,489;11,490;11,325
MOBIL CEPU LTD;217,068;213,604;209,117;204,462;200,938;202,002;204,642;207,759;199,684;193,381;191,628;191,034
MONTDOR (SALAWATI) LTD.;30;22;29;22;32;21;32;20;30;19;30;19
MONTDOR OIL TUNGKAL LTD;739;751;666;689;759;719;675;658;630;647;596;496
PEARL OIL (SEBUKU) LTD.;21;36;34;27;31;35;25;27;15;20;19;5
OPHIR INDONESIA (BANGKANAI) LIMITED.;489;463;493;489;478;483;447;478;477;470;471;473
PERTAMINA HULU ENERGI KAMPAR;886;882;805;733;819;912;1,005;933;862;970;985;923
PERTAMINA HULU ENERGI ONWJ LTD;29,470;29,276;29,257;25,292;26,302;26,515;24,234;25,831;27,397;28,040;26,199;27,921
PERTAMINA HULU ENERGI SIAK;1,663;1,647;1,717;1,802;1,739;1,877;1,777;1,670;1,590;1,594;1,536;1,498
PERTAMINA HULU ENERGI WEST MADURA OFFSHORE;2,743;2,660;2,554;2,468;2,416;2,450;2,362;2,408;2,016;1,976;1,968;1,935
PETROCHINA INTERNATIONAL BANGKO LTD;171;202;166;167;146;152;142;129;129;133;135;123
PETROCHINA INTERNATIONAL JABUNG LTD;15,060;14,322;14,857;14,960;15,040;14,930;15,759;15,773;16,263;16,161;16,154;15,892
PETROGAS (BASIN) LTD;4,525;4,578;4,518;4,681;4,562;4,555;4,779;4,457;4,227;4,302;4,335;4,235
PETRONAS CARIGALI (KETAPANG) LTD;8,077;7,543;7,755;7,430;7,488;6,351;7,114;6,855;6,731;6,507;6,313;6,442
PHE OGAN KOMERING;1,277;1,224;1,336;1,612;1,765;1,765;1,728;1,727;1,666;1,683;1,666;1,597
PHE TUBAN EAST JAVA;1,407;1,336;1,224;1,193;976;973;863;1,085;952;1,015;984;797
PHM;30,342;28,965;25,588;25,860;24,840;26,016;24,434;22,137;23,899;20,398;24,032;22,948
PREMIER OIL INDONESIA;1,852;1,946;1,910;1,739;1,797;1,168;1,047;1,802;1,719;1,655;1,382;1,563
PT PERTAMINA HULU ENERGI JAMBI MERANG;4,895;4,882;4,796;4,678;4,780;4,638;4,556;4,840;3,880;3,222;4,437;4,455
PT PERTAMINA HULU KALIMANTAN TIMUR;8,341;8,418;9,547;9,173;9,387;9,691;9,366;9,183;9,609;9,291;9,153;10,404
PT PERTAMINA HULU SANGA SANGA;11,887;12,042;11,607;11,417;11,622;12,173;12,547;13,089;12,902;12,810;11,807;12,948
PT PERTAMINA HULU ROKAN;163827;161572;163294;159093;157828;158319;159516;158857;157965;159084;161921;160007
PT. ENERGI MEGA PERSADA TONGA;0;0;0;0;0;0;0;0;0;0;0;0
PT. PERTAMINA EP;73879;73860;72997;72274;71952;70881;69894;68534;69887;70932;69958;71739
PT. SARANA PEMBANGUNAN RIAU LANGGAK;534;530;534;527;536;529;529;509;501;504;485;485
PT. SELERAYA MERANGIN DUA;2440;2346;2308;2782;2790;2910;3147;3086;3438;3455;3422;3208
PT.MEDCO E&P INDONESIA;4077;3871;3760;3350;3478;3348;3381;3342;3100;3299;3200;3130
PT.MEDCO E&P RIMAU;6301;6367;6414;6309;6161;5997;5915;5847;5699;5798;5557;5682
PT.MEDCO E&P TARAKAN;1014;1033;1007;1032;1026;1006;1053;874;886;913;737;857
SAKA INDONESIA PANGKAH LTD;4093;4019;3319;3476;4080;4150;4123;5321;5097;6551;6554;8518
OPHIR INDONESIA (SAMPANG) PTY. LTD.;129;140;132;129;117;108;137;139;137;132;137;126
STAR ENERGY LTD;1449;1327;1391;1348;1361;1296;1348;1169;1094;885;884;1032
TATELY N.V.;131;132;131;136;131;130;103;154;157;247;201;57
TIARA BUMI PETROLEUM;112;102;102;101;99;71;81;82;149;146;143;151
PT TROPIK ENERGI PANDAN;171;169;156;120;90;137;95;70;66;54;45;27
PT MEDCO E&P MALAKA;976;961;762;26;452;376;1195;1435;1480;1392;1535;1525
PT ODIRA ENERGY KARANG AGUNG;222;349;309;380;420;356;411;346;422;364;373;343
PT SELE RAYA BELIDA;23;27;28;38;30;33;32;35;34;30;29;28
PT PERTAMINA HULU ENERGI NORTH SUMATERA OFFSHORE;41;14;0;0;2;296;21;0;0;0;158;0
PT PEMA GLOBAL ENERGI;685;747;906;1157;885;883;1102;1266;1196;779;313;816
PT PERTAMINA HULU ENERGI RANDUGUNTING;7;15;8;8;6;13;6;5;12;10;8;1
PT PERTAMINA EP CEPU ADK;0;0;0;0;0;0;0;0;0;0;0;0
PT SUMATRA GLOBAL ENERGI;0;0;0;0;0;0;0;0;0;0;0;0
EMP GEBANG LTD.;0;0;0;0;0;0;0;0;0;0;0;0
ENERGI MEGA PERSADA BENTU LTD;0;0;0;0;0;0;0;0;0;0;0;0
JOB PERTAMINA MEDCO SIMENGGARIS;0;0;0;0;0;0;0;0;0;0;0;0
MANHATTAN KALIMANTAN INVESTMENT PTE. LTD.;0;0;0;0;0;0;0;0;0;0;0;0
STARBORN ENERGY BONTANG PTE. LTD.;0;0;0;0;0;0;0;0;0;0;0;0
AWE (NORTHWEST NATUNA) PTE. LTD.;0;0;0;0;0;0;0;0;0;0;0;0
TRIANGLE PASE INC.;0;0;0;0;0;0;0;0;0;0;0;0
OPHIR INDONESIA (MADURA OFFSHORE) PTY. LTD.;0;0;0;0;0;0;0;0;0;0;0;0
PT.MEDCO E&P LEMATANG;0;0;0;0;0;0;0;0;0;0;0;0
PERUSDA BENUO TAKA;0;0;0;0;0;0;0;0;0;0;0;0
PT MANDIRI PANCA USAHA;0;0;0;0;0;0;0;0;0;0;0;0
ENI EAST SEPINGGAN LTD.;0;0;0;0;0;0;0;0;0;0;0;0
PACIFIC OIL & GAS (KISARAN) LTD.;0;0;0;0;0;0;0;0;0;0;0;0
PT SUMATERA PERSADA ENERGI;0;0;0;0;0;0;0;0;0;0;0;0
SAKA ENERGI MURIAH LTD.;0;0;0;0;0;0;0;0;0;0;0;0
JINDI SOUTH JAMBI B CO. LTD;0;0;0;0;0;9;38;0;135;80;64;75
TEXCAL MAHATO EP LTD.;265;678;1355;1636;2154;2691;3580;3566;3453;3943;4069;4398
PASIR PETROLEUM RESOURCES LTD.;0;0;0;0;0;0;0;0;0;0;0;215
PT PERTAMINA EP CEPU;0;0;0;0;0;0;0;0;0;0;0;0
